line,page,week,num_likes,domain,outlet,title,description,contenttype,image,url,text,id,right_of_center
3149,DieGruenen,39,0,welt.de,DIE WELT,Grüne missbrauchen Flüchtlinge für ihren Klassenkampf,"Die Grünen wollen in einer Berliner Luxusanlage Wohnungen beschlagnahmen – angeblich für Flüchtlinge. Doch ein genauer Blick auf den Vorgang zeigt, dass es in Wahrheit um etwas ganz anderes geht.",article,http://img.welt.de/img/deutschland/crop146838005/1286938674-ci3x2l-w900/Germany-Distributes-Arriving-Migrants-Nationwide.jpg,http://www.welt.de/politik/deutschland/article146799007/Gruene-missbrauchen-Fluechtlinge-fuer-ihren-Klassenkampf.html,"\"Von Alan Posener Alan Posener Biografie und alle Artikel des Autors Korrespondent für Politik und Gesellschaft Besser kann man in einer Metropole kaum wohnen: Riehmers Hofgarten in Berlin-Kreuzberg mit begrüntem Innenhof. Geht es nach den Grünen, sollen hier Wohnungen für Flüchtlinge zwangsbeschlagnahmt werden Foto: picture alliance / Florian Monhe Der Zustrom von Flüchtlingen setzt die Politik unter Druck. Manche Politiker nutzen jedoch die Flüchtlinge, um ihr eigenes Süppchen zu kochen. Nicht nur auf der Rechten; auch auf der Linken. Zurzeit bietet der Szenebezirk Berlin-Kreuzberg dafür ein trauriges Exempel. Dort sollte die Bezirksverordnetenversammlung auf Antrag der Grünen beschließen, leer stehende Wohnungen zu beschlagnahmen, um Flüchtlinge und andere Obdachlose unterzubringen. Keine Frage: Auch Berlin hat ein Flüchtlingsproblem , auch wenn es nur fünf Prozent der in Deutschland ankommenden Asylsuchenden aufnimmt. Bis zu 50.000 sollen es dieses Jahr werden. Kasernen, Baracken und Turnhallen werden requiriert, das Wilmersdorfer Rathausgebäude leer geräumt, Zelte und Container aufgestellt. Dabei werden nicht alle Bezirke gleichermaßen belastet. Das bürgerliche Zehlendorf nimmt gerade mal ein paar Hundert, das proletarisch-kleinbürgerliche Spandau mehr als 2000 Menschen auf. Friedrichshain-Kreuzberg, der grün regierte frühere Multikulti-Vorzeigebezirk, immer noch Vorzeigebezirk, aber inzwischen eher monokulturell und als Wohnort entsprechend teuer, liegt im unteren Mittelfeld. Ein Notstand liegt hier kaum vor. Dennoch heißt es im Antrag, den der Abgeordnete Andreas Weeger im Namen der Grünen -Fraktion einbrachte, Wohnraum sei nach dem Allgemeinen Gesetz zum Schutz der öffentlichen Sicherheit und Ordnung (ASOG) \"\"zur Gefahrenabwehr zu requirieren\"\"","und zwar \"\"besonders dort","wo spekulativer Leerstand von eigentlich bezugsfertigen Wohnungen geballt vorhanden\"\" sei. Der Antrag benennt auch einen Ort"
3150,DieGruenen,39,0,youtube.com,YouTube,,,,,https://www.youtube.com/watch?v=0OXUOr6kpTc&feature=youtu.be,,3150,False
3151,DieGruenen,39,0,focus.de,,,,,,http://m.focus.de/politik/deutschland/nach-forderung-zur-integrationspflicht-kloeckner-hunderte-frauen-reden-sich-bei-mir-frust-ueber-muslimische-maenner-von-der-seele_id_4972380.html?utm_source=facebook&utm_medium=social&utm_campaign=facebook-focus-online-politik&fbc=facebook-focus-online-politik&ts=201509251313,"\"Äußerungen der CDU-Frau rufen Reaktionen hervor Hunderte Frauen klagen über muslimische Männer - Klöckner: \"\"Was akzeptieren wir noch alles?\"\" 25.09.2015 | 13:01 von FOCUS-Online-Korrespondentin Martina Fietz     dpa/Stephanie Pilick Julia Klöckner sieht die Grenzkontrollen als Zeichen an die EU. CDU-Vize Julia Klöckner hatte gefordert",dass Zuwanderer sich zu den deutschen Grundwerten bekennen müssen – und damit eine Schleuse geöffnet. Hunderte Frauen meldeten sich bei der Politikerin und redeten sich ihren Frust über das Verhalten muslimischer Jungen und Männer von der Seele. Im Büro von Julia Klöckner herrscht Ausnahmezustand. Mehr als 300 Bürger haben sich allein Mittwoch und Donnerstag per Mail bei der rheinland-pfälzischen CDU -Partei- und Fraktionsvorsitzenden gemeldet. Das Telefon steht nicht mehr still. Überwiegend sind es Frauen,die sich ihren Frust von der Seele schreiben oder reden. Frauen
3152,DieGruenen,39,0,homment.com,,,,,,http://homment.com/s9GY2tM2Rh,,3152,False
3153,DieGruenen,39,0,google.com,,,,,,https://docs.google.com/forms/d/11Mu3nXOAEMDu9yGafIFEQh5aY7uRpkxi0dn4zP8yiww/viewform,"\"Das Formular \"\"Wen würden Sie wählen wenn am Sonntag Wahlen wären?\"\" nimmt keine weiteren Antworten mehr an.Kontaktieren Sie den Inhaber des Formulars",wenn Sie der Meinung sind,"dass hier ein Fehler vorliegt. Das Formular \"\"Wen würden Sie wählen wenn am Sonntag Wahlen wären?\"\" nimmt keine weiteren Antworten mehr an. Kontaktieren Sie den Inhaber des Formulars"
3154,DieGruenen,39,1,evangelisch.de,,,,,,http://www.evangelisch.de/inhalte/125129/23-09-2015/thilo-hoppe-kurswechsel-entwicklungspolitik-ekd-studie-fuer-nachhaltige-entwicklung-kosten-anderer,"\"Wir dürfen nicht auf Kosten anderer leben Foto: Getty Images/David Malan Die EKD-Studie mit dem Titel \"\"… damit sie das Leben und volle Genüge haben sollen\"\" wirbt für eine breite gesellschaftliche Diskussion über neue Leitbilder für eine nachhaltige und global gerechte Entwicklung. Sie fragt","unter welchen Bedingungen \"\"gutes Leben\"\" für alle Menschen unter Wahrung der natürlichen Lebensgrundlagen möglich ist. Thilo Hoppe","entwicklungspolitischer Sprecher von \"\"Brot für die Welt\"\""
3155,DieGruenen,39,0,stepstone.de,,,,,,http://www.stepstone.de/stellenangebote--FACHKRAFT-M-W-FUeR-DIE-IT-ABTEILUNG-Berlin-Bundestagsfraktion-Buendnis-90-Die-Gruenen--3477271-inline.html?cid=banner_retargeting_criteo___Y,"Unsere Webseite verwendet Cookies, um Ihnen eine bessere Nutzererfahrung zu ermöglichen. Durch die Nutzung unserer Webseite stimmen Sie unserer Verwendung von Cookies zu. Mehr",3155,False
3156,DieGruenen,39,0,change.org,Change.org,Wir fordern den Rücktritt der Bundeskanzlerin Dr. A. Merkel und sofortige Neuwahl der Bundesregierung --- Resignation of the German Chancellor Dr. A. Merkel and immediate reelection of the German Government,"Rücktritt der dt. Bundeskanzlerin Dr. Angela Merkel und sofortige Neuwahl der Bundesregierung    Frau Dr.  Merkel  handelt unverantwortlich nicht nur Deutschland gegenüber, sondern auch der EU und ganz Europa. Sie setzt Gesetze außer Kraft, ohne die Folgen zu bedenken. Sie und Ihre Regierung sind nicht...",change-org:petition,http://d22r54gnmuhwmk.cloudfront.net/photos/3/tb/jp/jkTBJPGQPoPBMwE-1600x900-noPad.jpg?1442112478,https://www.change.org/p/wir-fordern-den-rücktritt-der-bundeskanzlerin-dr-a-merkel-und-sofortige-neuwahl-der-bundesregierung-resignation-of-the-german-chancellor-dr-a-merkel-and-immediate-reelection-of-the-german-government,"\"Deutscher Bundestag Wir fordern den Rücktritt von Frau Dr. Merkel und sofortige Neuwahl der Bundesregierung. Frau Dr.  Merkel  handelt unverantwortlich nicht nur Deutschland gegenüber, sondern auch der EU und ganz Europa. Sie setzt Gesetze außer Kraft, ohne die Folgen zu bedenken. Sie und Ihre Regierung sind nicht mehr \"\"Herr der Lage“ und somit weder fähig Deutschland zu regieren noch bei für die EU relevanten Belange",weitreichende Entscheidungen zu treffen. Begründung: Frau Dr. Merkel und die amtierende Bundesregierung handelt seit Jahren nicht mehr im Sinne der deutschen Bevölkerung. Den Ausschlag dieser Petition gab zwar die aktuelle Flüchtlingspolitik,die nicht nur kurzfristig ein Potenzial des Verlustes  bzw. Gefährdung der inneren Sicherheit in sich birgt
3157,DieGruenen,39,0,youtube.com,YouTube,,,,,https://www.youtube.com/watch?v=BBTDBG6MafA,,3157,False
3158,DieGruenen,39,0,change.org,,,,,,https://www.change.org/p/bundesregierung-deutschland-mehr-mitbestimmung-bei-wichtigen-themen-wie-ttip-ceta?recruiter=389955036&utm_source=share_petition&utm_medium=copylink,,3158,False
3159,DieGruenen,39,0,change.org,Change.org,Wir fordern den Rücktritt der Bundeskanzlerin Dr. A. Merkel und sofortige Neuwahl der Bundesregierung --- Resignation of the German Chancellor Dr. A. Merkel and immediate reelection of the German Government,"Rücktritt der dt. Bundeskanzlerin Dr. Angela Merkel und sofortige Neuwahl der Bundesregierung    Frau Dr.  Merkel  handelt unverantwortlich nicht nur Deutschland gegenüber, sondern auch der EU und ganz Europa. Sie setzt Gesetze außer Kraft, ohne die Folgen zu bedenken. Sie und Ihre Regierung sind nicht...",change-org:petition,http://d22r54gnmuhwmk.cloudfront.net/photos/3/tb/jp/jkTBJPGQPoPBMwE-1600x900-noPad.jpg?1442112478,https://www.change.org/p/wir-fordern-den-rücktritt-der-bundeskanzlerin-dr-a-merkel-und-sofortige-neuwahl-der-bundesregierung-resignation-of-the-german-chancellor-dr-a-merkel-and-immediate-reelection-of-the-german-government,"\"Deutscher Bundestag Wir fordern den Rücktritt von Frau Dr. Merkel und sofortige Neuwahl der Bundesregierung. Frau Dr.  Merkel  handelt unverantwortlich nicht nur Deutschland gegenüber, sondern auch der EU und ganz Europa. Sie setzt Gesetze außer Kraft, ohne die Folgen zu bedenken. Sie und Ihre Regierung sind nicht mehr \"\"Herr der Lage“ und somit weder fähig Deutschland zu regieren noch bei für die EU relevanten Belange",weitreichende Entscheidungen zu treffen. Begründung: Frau Dr. Merkel und die amtierende Bundesregierung handelt seit Jahren nicht mehr im Sinne der deutschen Bevölkerung. Den Ausschlag dieser Petition gab zwar die aktuelle Flüchtlingspolitik,die nicht nur kurzfristig ein Potenzial des Verlustes  bzw. Gefährdung der inneren Sicherheit in sich birgt
3160,DieGruenen,39,0,change.org,,,,,,https://www.change.org/p/wir-fordern-das-misstrauensvotum-r%C3%BCcktritt-der-bundeskanzlerin-dr-a-merkel-und-sofortige-neuwahl-der-bundesregierung-resignation-of-the-german-chancellor-dr-a-merkel-and-immediate-reelection-of-the-german-government?recruiter=90133712&utm_source=share_petition&utm_medium=facebook&utm_campaign=autopublish&utm_term=des-lg-no_src-reason_msg&fb_ref=Default,"\"Wenn Sie sich einloggen oder registrieren (auch via Facebook) akzeptieren Sie die Nutzungsbedingungen und Datenschutzbestimmungen von Change.org. Petition geschlossen. Rücktritt der dt. Bundeskanzlerin Dr. Angela Merkel und sofortige Neuwahl der Bundesregierung Diese Petition hat 263.908 Unterschriften erreicht Monika Hanutko hat diese Petition an Deutscher Bundestag gestartet. Rücktritt der dt. Bundeskanzlerin Dr. Angela Merkel und sofortige Neuwahl der Bundesregierung Frau Dr.  Merkel  handelt unverantwortlich nicht nur Deutschland gegenüber, sondern auch der EU und ganz Europa. Sie setzt Gesetze außer Kraft, ohne die Folgen zu bedenken. Sie und Ihre Regierung sind nicht mehr \"\"Herr der Lage“ und somit weder fähig Deutschland zu regieren noch bei für die EU relevanten Belange",weitreichende Entscheidungen zu treffen. (Liebe Unterzeichner: Eine ausführliche Begründung unserer Forderung finden Sie im Petitionsbrief unten) Resignation of the German Chancellor Dr. Angela Merkel and immediate reelection of the German Government Dr. Merkel is acting irresponsible not only for Germany,"but also for the EU and whole Europe. She is overruling laws without considering the consequences. She and the German Government are no longer \"\"master of the situation\"\" and therefore no longer able to run Germany or to have a strong political vote in the EU. Démission de la chancelière allemande Dr. Angela Merkel et nouvelle élection immédiate du gouvernement fédéral Mme Merkel agit de manière irresponsable non seulement envers I'Allemagne"
3161,DieGruenen,39,0,kopp-verlag.de,,Migrationswaffe: Der genialste Krieg aller Zeiten,,,http://info.kopp-verlag.de/data/asset/22431/firstoverview.jpg,http://info.kopp-verlag.de/hintergruende/deutschland/gerhard-wisnewski/migrationswaffe-der-genialste-krieg-aller-zeiten.html,"\"Copyright © 2015 Das Copyright für die Artikel von Gerhard Wisnewski liegt beim Autor Bildnachweis: picture-alliance Dieser Beitrag stellt ausschließlich die Meinung des Verfassers dar. Er muss nicht zwangsläufig die Meinung des Verlags oder die Meinung anderer Autoren dieser Seiten wiedergeben. Leser-Kommentare (148) zu diesem Artikel 27.10.2015 | 11:10 Ilona Kasparov Klasse, wie das heute so geht. Den Hörstel habe ich auf Facebook abonniert, ich gebe den von ihm verwendeten Begriff „MIGRATIONSWAFFE“ bei Google ein und zack; schon bin ich mitten drin im braunen, staatszersetzenden, Juden und Ausländer hassenden Sumpf des Kopp-Verlages. Bitte verstehen Sie mich nicht falsch: Nicht alles, was die Autoren hier schreiben, lehne ich ab. Mich würde der Mainstream sicher auch als kleine Verschwörungstheoretikerin bezeichnen. Aber es ist schon so,... Klasse, wie das heute so geht. Den Hörstel habe ich auf Facebook abonniert, ich gebe den von ihm verwendeten Begriff „MIGRATIONSWAFFE“ bei Google ein und zack; schon bin ich mitten drin im braunen, staatszersetzenden, Juden und Ausländer hassenden Sumpf des Kopp-Verlages. Bitte verstehen Sie mich nicht falsch: Nicht alles, was die Autoren hier schreiben, lehne ich ab. Mich würde der Mainstream sicher auch als kleine Verschwörungstheoretikerin bezeichnen. Aber es ist schon so, zumindest sehe ich das so, dass dieser Verlag und seine Autoren zur medialen Speerspitze dessen gehören, was Deutschland schon einmal ins Verderben geführt hat und sich gerade wieder daran macht, einen entsprechenden Wandel herbeizuführen. Ein Blick in die Kommentare reicht, um das festzustellen. Hier grüßen PEGIDA, HOGESA usw. Ich persönlich sehe jedenfalls eine viel größere Gefahr in der Parallelgesellschaft, die rechtsextreme Gruppierungen heute in Deutschland bilden, als in denen, die durch die Flüchtlinge entstehen könnten. Ich sehe deutsche Steuergelder, die aufgebracht werden müssen, um diesen rechten Sumpf zu überwachen, um Brände zu löschen, die aus ihm heraus gelegt werden, um beschädigte deutsche Gebäude wiederherzustellen und um Opfer rechter Gewalt zu entschädigen. Bei aller Kritik, die man an unserer Regierung, ihren Bündnispartnern, ihrer Politik und ihrem Wirtschaftssystem äußern kann und muss: Es besteht mit Sicherheit kein Heil für Deutschland darin, dem nachzurennen, was die derzeit in Deutschland agierende Rechtsextreme als vermeintliche Lösungen für die deutschen Probleme anbietet. Ja, ich halte es auch für plausibel, dass viele der aktuellen, weltweit stattfindenden Verwerfungen von Kreisen, die ich nicht mit Sicherheit bestimmen kann, gezielt initialisiert werden, weil dahinter bestimmte wirtschaftliche und/oder geopolitische Interessen stehen. Aber wenn Deutschland etwas aus seiner Geschichte gelernt hat, dann hoffentlich, dass es sich nicht wieder Vollstreckern an den Hals wirft, die sich schon damals nicht zu schade waren, sich mit Geldern aus Übersee aufrüsten und fördern zu lassen. Es gibt viele Probleme, aber keines dieser Probleme rechtfertigt es, erneut Nazis hinterher zu rennen! Und zu diesem Propaganda-Begriff „Migrationswaffe“ möchte ich kurz anmerken, dass jeder, der diesen so benutzt wie in diesem Artikel, bewusst oder fahrlässig mitverantwortlich ist für die Radikalisierung in Deutschland und die damit verbundenen Übergriffe auf Flüchtlinge, Sanitäter, Bürgermeisterkandidaten etc. Denn der gemeine Soldat im Feld wird sicherlich zuerst versuchen, die Waffen/die Truppen des Gegners auszuschalten. Und zur hier kolportierten „Jung-Stark-Männlich“-These möchte ich sagen, dass ich sie für verfehlt halte. Würde es sich um herkömmliche Kriege handeln, bei denen sich klar definierte Gegner gegenüber stehen, dann könnte ich die Forderung, dass sie gefälligst für ihr Land kämpfen sollen, verstehen. Im Nahen Osten gibt es aber keine klaren Fronten, keine Staatsführer, denen sich die Menschen in den einzelnen Ländern ergeben fühlen könnten. Ich wüsste auch nicht, für was oder wen ich da noch kämpfen sollte. Ich würde auch zusehen, dass ich da wegkomme. 23.10.2015 | 12:39 Axel Kramer Wer Flüchtlinge als \"\"Invasionsarmee\"\" bezeichnet",ist dumm und hat nicht begriffen,was in der Welt passiert. WIR haben die Waffen und Bomben in diese Länder verkauft und uns dadurch eine goldene Nase verdient. Ohne diese Waffenlieferungen wäre unsere Wirtschaft niemals da
3162,DieGruenen,39,0,paradiso-magazin.de,,,,,,http://www.paradiso-magazin.de/wie-viel-technik-tut-gut/,"in Leben im digitalen Zeitalter , Perspektiven entdecken / 19. September 2015 Interview mit dem Rostocker Energiewende-Experten Johann-Georg Jaeger Sein berufliches und politisches Engagement gilt vor allem der Energiewende. Der Rostocker Johann-Georg Jaeger (48) ist Projektentwickler im Bereich regenerative Energien und Parlamentarischer Geschäftsführer von Bündnis90/Die Grünen im Landtag von Mecklenburg-Vorpommern. Über Fluch und Segen der rasanten technischen Entwicklung sprach mit ihm Tilman Baier. Herr Jaeger, wieviel Technik braucht der Mensch? Das ist extrem unterschiedlich, je nach Lebenssituation. Wenn ich gesund bin, den Hang zum ländlichen Leben habe und fast Selbstversorger bin, sieht das ganz anders aus, als wenn ich schwerkrank auf der Intensivstation liege. Letztlich geht es aber um die Fragen, die sich durch unser ganzes Leben ziehen: Von welcher Technik wollen wir uns abhängig machen? Beherrschen wir die Technik oder beherrscht sie uns? Unseren Grad der Abhängigkeit bemerken wir sofort, wenn Technik versagt: Noch vor einigen Jahren konnte jeder einigermaßen handwerklich Begabte einiges am Auto selbst reparieren. Das ist heute kaum noch möglich. Ich bin da auf einen Spezialisten angewiesen. Aber den Slogan „back to the roots“, zurück in eine Welt ohne Strom, Telefon und schnelle Verkehrsmittel als Zukunftsperspektive für alle – das kann niemand ernsthaft fordern. Aber es gibt doch immer wieder Aussteiger, die versuchen, sich aus der Abhängigkeit von der Technik zu befreien … Für Einzelne mag solch ein Versuch ja reizvoll sein und zeitweise gelingen, aber er taugt nicht für eine Gesellschaft, geschweige denn für die ganze Welt. Maos Kulturrevolution, die Versuche der Roten Khmer, Kambodscha in ein Agrarland der Vormoderne zurückzuverwandeln, haben Millionen Tote gekostet und sind gescheitert. Und auch der Selbstversorger, der sich in Deutschland in eine Hütte ohne Strom zurückzieht, braucht den Austausch mit der umgebenden Gesellschaft, die von moderner Technik durchdrungen ist – und sei es im Dorfladen. Aussteigen ist also keine Option für Sie? Es ist noch gar nicht viele Generationen her, da bedeuteten auch bei uns in Deutschland zwei Missernten hintereinander großen Hunger oder gar den Tod. Und das bedeuten Missernten noch heute in den Teilen der Welt, wo eine Selbstversorgerwirtschaft ohne moderne Technik überwiegt. Auch wenn das Bevölkerungswachstum in Zukunft, wie manche Demografen meinen, nicht mehr so rasant verläuft und sich bei zehn bis elf Milliarden Menschen einpegelt, so wollen diese doch ausreichend zu essen haben, menschlich wohnen und an der Gesellschaft teilhaben. Dazu brauchen wir Technik. Und was ist mit der Überforderung durch die uns umgebende Technik, die wohl jeder schon einmal erlebt hat? Auch unsere Ururgroßeltern haben die Einführung neuer Techniksysteme in ihrem Alltag erlebt, die das tägliche Leben stark veränderten. Auch die Eisenbahn war zunächst heiß umstritten. Aber für die nächste Generation schon waren die qualmenden Dampflokomotiven selbstverständlich, immer da gewesen. Letztlich muss jeder für sich selbst entscheiden, wo er für sich eine Grenze zieht. Können auch Kinder diese Grenze selbst ziehen? Etwa im Hinblick auf Fernsehen oder -Facebook … Ich mache mir da schon Sorgen. Ich habe bei mir selbst erlebt und erlebe auch bei Kindern, wie das virtuelle Leben in einem Computerspiel in den Bann ziehen kann und dadurch Erfahrungen in der Realität weniger werden. Ich selbst spiele nicht mehr Computerspiele, seit ich gemerkt habe, was sie für eine Sogwirkung ent­falten. Hier brauchen wir Aufklärung, gute Bildung und Medienkompetenz. Kritiker behaupten, dass sich immer die Technologie durchsetzt, die mit viel Geld und Macht auf den Markt gedrückt wird. Dadurch hätten Rechteinhaber wie Microsoft, Google oder Facebook einen Einfluss auf unser Leben gewonnen, der stärker sei als in mancher Diktatur … Ich bin ein Fan von Vernetzung und gegen marktbeherrschende Monopole. Aber, um beim Computer zu bleiben: Das Betriebssystem Linux, von dem die Quelldateien öffentlich bekannt sind und das jeder mitgestalten kann, ist etwas für Menschen, die mehr vom Computer verstehen als ich. Ich will mich darum nicht kümmern müssen, für mich ist der Computer ein Arbeitswerkzeug, das funktionieren soll. Wer die Macht eines Monopols brechen will, muss auch darauf achten, dass die vielen Bausteine, die einzelne kleine Gruppen entwickeln, dann auch zueinanderpassen. Ich habe die Deutsche Industrienorm, besser bekannt unter dem Kürzel DIN, erst richtig in Afrika schätzen gelernt: Da habe ich erlebt, welche großen Anstrengungen unternommen werden, um durch inner­afrikanische Standardisierungen den grenzüberschreitenden Handel voranzubringen. Noch einmal: Wieviel Technik braucht der Mensch? Eine Welt mit bald zehn oder elf Milliarden Menschen kann nur mit einer Technik, die ständig weiter entwickelt wird, die nötigen Lebengrundlagen für alle vorhalten. Es geht also darum, gegenüber neuen Technologien offen und neugierig zu bleiben – und gleichzeitig wach und kritisch. Auch wenn Technik vieles ermöglicht – das Lebensglück misst sich an anderen Kriterien. Das Interview führte  Tilman Baier mit Johann-Georg Jaeger, Johann-Georg Jaeger Geboren 1965 in Ludwigslust, Theologiestudium in Rostock mit Freistellung für die Arbeit am Runden Tisch des Bezirkes Rostock, Mitbegründer (u.a. mit Joachim Gauck) des Neuen Forums in Rostock, Delegierter im Republiksprecherrat des Neuen Forums, dann für Bündnis90/Die Grünen in der Bürgerschaft Rostock. Seit 2011 Parlamentarischer Geschäftsführer der Fraktion im Landtag, Mitglied im Vorstand der „Ökumenischen Stiftung für Schöpfungsbewahrung und Nachhaltigkeit“.",3162,False
3163,DieGruenen,39,0,change.org,Change.org,Wir fordern den Rücktritt der Bundeskanzlerin Dr. A. Merkel und sofortige Neuwahl der Bundesregierung --- Resignation of the German Chancellor Dr. A. Merkel and immediate reelection of the German Government,"Rücktritt der dt. Bundeskanzlerin Dr. Angela Merkel und sofortige Neuwahl der Bundesregierung    Frau Dr.  Merkel  handelt unverantwortlich nicht nur Deutschland gegenüber, sondern auch der EU und ganz Europa. Sie setzt Gesetze außer Kraft, ohne die Folgen zu bedenken. Sie und Ihre Regierung sind nicht...",change-org:petition,http://d22r54gnmuhwmk.cloudfront.net/photos/3/tb/jp/jkTBJPGQPoPBMwE-1600x900-noPad.jpg?1442112478,https://www.change.org/p/wir-fordern-den-rücktritt-der-bundeskanzlerin-dr-a-merkel-und-sofortige-neuwahl-der-bundesregierung-resignation-of-the-german-chancellor-dr-a-merkel-and-immediate-reelection-of-the-german-government,"\"Deutscher Bundestag Wir fordern den Rücktritt von Frau Dr. Merkel und sofortige Neuwahl der Bundesregierung. Frau Dr.  Merkel  handelt unverantwortlich nicht nur Deutschland gegenüber, sondern auch der EU und ganz Europa. Sie setzt Gesetze außer Kraft, ohne die Folgen zu bedenken. Sie und Ihre Regierung sind nicht mehr \"\"Herr der Lage“ und somit weder fähig Deutschland zu regieren noch bei für die EU relevanten Belange",weitreichende Entscheidungen zu treffen. Begründung: Frau Dr. Merkel und die amtierende Bundesregierung handelt seit Jahren nicht mehr im Sinne der deutschen Bevölkerung. Den Ausschlag dieser Petition gab zwar die aktuelle Flüchtlingspolitik,die nicht nur kurzfristig ein Potenzial des Verlustes  bzw. Gefährdung der inneren Sicherheit in sich birgt
3164,DieGruenen,39,0,youtube.com,YouTube,Dramatische Bilder! Das verschweigt die Lügenpresse,"Die Lügenpresse verschweigt die wirkliche Fratze der unkontrollierten Einwanderung. Europa muss aufwachen. Wenn nicht zeitnah die Grenzen geschlossen werden,...",video,https://i.ytimg.com/vi/e_GYlnC5g2M/maxresdefault.jpg,https://www.youtube.com/watch?v=e_GYlnC5g2M,"Möchtest du dieses Video später noch einmal ansehen? Wenn du bei YouTube angemeldet bist, kannst du dieses Video zu einer Playlist hinzufügen.",3164,False
3165,DieGruenen,39,0,youtube.com,YouTube,,,,,https://www.youtube.com/watch?v=cckf7mIJKmM,"Datenschutzhinweis für YouTube, ein Google-Unternehmen Navigation überspringen",3165,False
3166,DieGruenen,39,0,facebook.com,,,,,,https://www.facebook.com/vitabook.de.refugee,,3166,False
3854,SPD,39,283,spdlink.de,,,,,,http://spdlink.de/sR6m,"twitter youtube Diese Webseite verwendet Cookies, auch zur Optimierung der Webseitennutzung und zur Auswertung von Webseitenbesuchen. Einzelheiten über die von uns eingesetzten Cookies und die Möglichkeit diese abzulehnen, finden Sie in unseren Datenschutzhinweisen . Durch die Nutzung unserer Webseite erklären Sie sich mit der Verwendung von Cookies einverstanden.",3854,False
3855,SPD,39,68,storify.com,,,,,,https://storify.com/SPD/fragtsg,,3855,False
