line,page,week,num_likes,domain,outlet,title,description,contenttype,image,url,text,id,right_of_center
7284,AfD,39,0,faz.net,,,,,,http://www.faz.net/aktuell/politik/fluechtlingskrise/fluechtlinge-in-europa-fluechtlingskrise-im-live-ticker-13786125.html,"Warum sehe ich FAZ.NET nicht? Sie haben Javascript für Ihren Browser deaktiviert. Aktivieren Sie Javascript jetzt, um unsere Artikel wieder lesen zu können.",7284,True
7285,AfD,39,3,facebook.com,,,,,,https://www.facebook.com/AfDBgL/posts/1648034472140941,,7285,True
7286,AfD,39,9,welt.de,DIE WELT,Wir brauchen eine Verabschiedungskultur,"Schleswig-Holsteins CDU-Chef fordert, dass nicht nur die Ankunft von Flüchtlingen im Fernsehen gezeigt wird – sondern auch Abschiebungen. Damit zieht er den Zorn aller anderen Parteien auf sich.",article,http://img.welt.de/img/deutschland/crop146800079/2996931592-ci3x2l-w900/Klausurtagung-CDU-Schleswig-Holstein.jpg,http://www.welt.de/politik/deutschland/article146800081/Wir-brauchen-eine-Verabschiedungskultur.html,"\"px Höhe Autoplay Das Bundesinnenministerium warnt mit einem Video Menschen aus dem Westbalkan davor, sich nach Deutschland schleusen zu lassen. Wer Schleppern Geld zahle, tausche sein Vermögen gegen Illusionen ein. Quelle: Bundesministerium des Innern SPD auf der Zinne, DGB auf der Zinne, Grüne noch weiter auf der Zinne, auch die FDP auf der Zinne. Mit einem einzigen Satz hat der bis dahin noch weitgehend unbekannte Landesvorsitzende der CDU Schleswig-Holstein , Ingbert Liebing, die Politik in Deutschlands hohem Norden in Wallung gebracht. Foto:  picture alliance/dpa Der Landesvorsitzende der schleswig-holsteinischen CDU, Ingbert Liebing, war bislang eher unbekannt – mit seinen Äußerungen zur Flüchtlingskrise dürfte sich das ändern Mit Blick auf eine aus seiner Sicht \"\"kippende Stimmung in der Bevölkerung\"\" forderte der auf Sylt lebende Christdemokrat","dass Bund und Länder in der Flüchtlingsfrage künftig nicht mehr ausschließlich auf eine \"\"Willkommenskultur\"\" setzen dürften. \"\"Wir brauchen auch eine Verabschiedungskultur\"\"","sagte Liebing und forderte unter anderem mehr \"\"öffentlich sichtbare Zeichen der Abschiebung \"\". Liebing – der seine Partei auch als Spitzenkandidat in die nächste Landtagswahl führen soll – setzt dabei unter anderem auf TV-Bilder: \"\"So wie Kamerateams Flüchtlinge an der Grenze bei der Einreise zeigen"
7287,AfD,39,0,welt.de,DIE WELT,Für Flüchtlinge gekündigt - Das war wie ein Tritt,"Nach 16 Jahren soll Bettina Halbey ihre Wohnung verlassen, weil die Stadt Nieheim sie als Flüchtlingsunterkunft nutzen will. Sie fühlt sich „völlig überrumpelt“. Der Bürgermeister sieht sich im Recht.",article,http://img.welt.de/img/deutschland/crop146825322/7726936987-ci3x2l-w900/Bettina-Halbey-51-und-das-Haus-in-dem-si.jpg,http://www.welt.de/politik/deutschland/article146825325/Fuer-Fluechtlinge-gekuendigt-Das-war-wie-ein-Tritt.html,"\"px Höhe Autoplay Im nordrhein-westfälischen Nieheim hat die Stadt zur Unterbringung von Flüchtlingen zu einer drastischen Maßnahme gegriffen. Mietern wurde mit Verweis auf Eigenbedarf die städtische Wohnung gekündigt. Quelle: N24 Bettina Halbey erzählt, dass sie den Kommentar bei Facebook \"\"aus Frust und aus vollem Herzen\"\" geschrieben habe. \"\"'Warum wird uns Mietern die Wohnung zur Unterbringung von Asylanten gekündigt","obwohl es so viele leer stehende Häusern gibt?' Oder so ähnlich habe ich es geschrieben\"\"",erzählt die 51-jährige Krankenschwester. Die Lokalpresse hatte sich gemeldet und berichtet. Halbey bekam zunächst nicht mit
7288,AfD,39,2,stuttgarter-nachrichten.de,stuttgarter-nachrichten.de,Leitartikel zur Flüchtlingskrise: Liebe deinen Übernächsten - Stuttgarter Nachrichten,"Deutschland redet sich die Armutszuwanderung schön. Viele freuen sich über jeden Flüchtling, haben aber kein Problem damit, den Nachbarn als fremdenfeindlich zu verunglimpfen, wenn der das etwas anders sieht.",article,http://www.stuttgarter-nachrichten.de/media.facebook.6ebfb10d-123a-4989-9793-97479466b708.normalized.jpg,http://www.stuttgarter-nachrichten.de/inhalt.leitartikel-zur-fluechtlingskrise-liebe-deinen-uebernaechsten.ef6e2003-3a3e-466a-bed8-d601ebf88cb6.html,"E-Mail   Kanzlerin Merkel zeigt einen Realitätsverlust wie einst Helmut Kohl.Foto: dpa Deutschland redet sich die Armutszuwanderung schön. Viele freuen sich über jeden Flüchtling, haben aber kein Problem damit, den Nachbarn als fremdenfeindlich zu verunglimpfen, wenn der das etwas anders sieht. Stuttgart - Müsste man eine Chronologie der Flüchtlingskrise schreiben, würde alles mit einer fast schon historischen Dummheit beginnen: Das Bundesverfassungsgericht kippte 2012 die Regeln zur Versorgung von Asylbewerbern und schuf in Deutschland eine Art Hartz-IV-Anspruch für alle Armen dieser Welt: 1500 Euro netto für eine fünfköpfige Familie, dazu kostenloses Wohnen – das ist das Angebot, das Deutschland seitdem der Welt macht. Kaum hatte sich das herumgesprochen, kamen die Armen vom Balkan, die bis heute fast 40 Prozent aller Asylbewerber ausmachen. Ein Drittel von ihnen kommt mehr als einmal, denn das Angebot ist zu attraktiv, um es ablehnen zu können. Aber es war nicht nur der Balkan, wo sich das Angebot herumsprach. Geschäftstüchtige Schleuser unterbreiteten es auch anderen Armen dieser Welt. Diese kamen, machten Fotos vom reichen Deutschland und schickten sie zurück in ihre Heimat. Die kostenlose WLAN-Verbindung stellte der deutsche Staat. Und so zogen immer mehr Flüchtlinge immer mehr neue Flüchtlinge nach sich. „Es ist ein Schneeballsystem“, sagt ein Beamter, der den Flüchtlingsstrom managen muss. Die Flüchtlinge kamen in ein Land, das erstaunlich naiv ist. Liebe deinen Nächsten, heißt es in der Bibel, aber der Deutsche hebt seine Gefühle gern für den Übernächsten auf. Dass die Flüchtlingszahlen erst nach Erhöhung der Bargeldzahlungen in die Höhe schossen, wurde fast kollektiv vergessen. Stattdessen wurden in der öffentlichen Debatte Krieg und Gewalt als feste Gründe installiert, warum die Zahlen steigen. Insbesondere der Bürgerkrieg in Syrien musste als Erklärung herhalten, obwohl von dort bis heute nicht einmal ein Drittel aller Flüchtlinge herkommen und selbst deren Leib und Leben nicht mehr bedroht ist, wenn sie die deutsche Grenze überqueren. Sie kommen, weil es hier am besten ist und viele Landsleute schon da sind. Deutschland importiert Armut – und die Wirtschaft applaudiert Aber wenn sich der Deutsche mal etwas eingeredet hat, hört er nicht mehr auf. Die Schleuser wissen darauf zu reagieren. Auf dem Papier kommen immer mehr syrische Flüchtlinge. Dies dürfte vor allem daran liegen, dass der Handel mit gefälschten syrischen Pässen floriert. Syrien gilt inzwischen als Zauberwort, das in Deutschland Türen und Herzen öffnet. Deutschland importiert mit dieser Politik Armut in großem Ausmaß und gefährdet sowohl seine Wettbewerbsfähigkeit als auch seinen Wohlstand. Aber nicht einmal die Wirtschaftsverbände sagen etwas dagegen, im Gegenteil: Sie begrüßen die Flüchtlinge, hoffen auf billige und willige Arbeitskräfte. Dass höchstens zehn Prozent der Flüchtlinge arbeitsfähig sind, wie dies unlängst Arbeitsministerin Andrea Nahles einräumte, wird ignoriert. Die Wirtschaft nimmt lieber die 10 von 100, als sich Gedanken darüber zu machen, was mit den restlichen 90 passiert. Das ist sehr kurzsichtig. Denn die restlichen 90 werden dem deutschen Staat zur Last fallen und somit die Steuer- und Abgabenlast weiter in die Höhe treiben. Uns geht es zu gut: Anders lässt sich die Flüchtlingskrise nicht erklären. Eine Krise, die vor allem Deutschland zu verantworten hat. Die Kanzlerin hat sich zur Schutzheiligen aller Flüchtlinge gemacht und damit die Krise verschärft. Damit erinnert Angela Merkel , was das Ausmaß des Realitätsverlusts angeht, an die späten Amtsjahre ihres CDU-Vorgängers Helmut Kohl. Man darf gespannt sein, ob sie aus dieser Nummer wieder herausfindet. Der Flüchtlingsgipfel an diesem Donnerstag wird das Problem wahrscheinlich nicht lösen. Und Merkels Forderung, andere Staaten sollten mehr tun, sind ein Ablenkungsmanöver. Diese Flüchtlingskrise wird erst enden, wenn Deutschland sein großzügiges Angebot an die Armen dieser Welt wieder zurücknimmt.",7288,True
