line,page,week,num_likes,domain,outlet,title,description,contenttype,image,url,text,id,right_of_center
504,Pegida,37,2286,focus.de,,,,,,http://m.focus.de/politik/auf-der-suche-nach-einer-friedensloesung-csu-will-im-syrienkonflikt-engere-zusammenarbeit-mit-russland_id_4942954.html,"Mirko Seigertz |                     13.09.2015 | 07:41 Uhr USA braucht Putin Die USA muss einsehen das die Russen wieder Partner werden müssen. Die provokationen durch Aufrüstung an den Grenzen müssen aufhören. Man muss in Kampf gegen den IS alle Kräfte bündeln und dabei Assad wohl als kleineres übel leider unterstützen. Man hat ja gesehen was durch den Sturz von Ghaddafi rausgekommen ist und auch im Irak is es nach Saddam nur schlimmer geworden. Sie haben bereits abgestimmt Adrian Hofer |                     13.09.2015 | 06:30 Uhr Bei einer Lösung im Kampf gegen den IS Seehofer will im Syrienkonflikt enger mit Putin zusammen arbeiten Herr Seehofer wie Recht sie doch auch dieses mal wieder haben, denn Ohne Russland bewegt sich dort NICHT´s Doch ich befürchte, Sie werden von den USA und Angela für diese Aussage, einen Gewaltigen Einlauf bekommen Geht ja schon Los mit dem ""Frank-Walter Steinmeier hatte Russland der Seite des syrischen Regimes vor Alleingängen gewarnt,, ""Es darf nicht sein, dass jeder auf eigene Faust in Syrien herumfuhrwerkt"" Herr Steinmeier die möchte gerne Weltmacht-Polizei, Ist dazu NICHT mehr in der Lage, und will es auch nicht, dort Ordnung zu schaffen Sie haben bereits abgestimmt karl heinz samfass |                     13.09.2015 | 05:10 Uhr Bitte Vorsichtig bei weiteren Alleingängen . Natürlich kann Mann mit Herrn Putin sprechen. Wichtig ist es diese irrsinnige Völkerwanderung zu Stoppen .Ob Mann dafür mit dem Himmel oder der Hölle verhandeln muss ist vollkommen Egal . Aber bitte trotzdem mit Vorsicht wir sollten Europa nicht noch mehr Spalten .Und wenn wir Deutsche zu Flüchtlingen werden wird uns möglicherweise keiner die Grenzen öffnen. Noch gehören wir zur NATO auch wenn manche das nicht gerne sehen . Sie haben bereits abgestimmt Wolfgang Luchs |                     13.09.2015 | 04:52 Uhr Endlich! Es geht nur gemeinsam mit Putin und Assad. Wer das immer noch nicht begriffen hat und sich dagegen windet, der muss weg von der Spitze, raus aus der Verantwortung, der ist mit schuld und Teil der Ursache für die aktuelle absurde Situation. Diese Zusammenarbeit mit Putin und Assad ist ""alternativlos"". Das ist die schnöde Realität liebe Regierenden! Sie haben bereits abgestimmt Frank Schauer |                     13.09.2015 | 04:06 Uhr Das kann man getrost vergessen! So lange Assad in Syrien an der Macht bleiben wird, wird es in diesem Land keinen Frieden geben können! Diese Tatsache wird auch die CSU nicht verdrängen können, denn Assad hat mittlerweile 250.000 Menschenleben auf dem Gewissen. Putin kann nur dann zusammen mit den westlichen Ländern bei der Bekämpfung des IS zusammenarbeiten, wenn er bereit ist Assad fallen zu lassen. Bisher ist diese Bereitschaft aber noch nicht erkennbar und deswegen sind die geplanten Gespräche der CSU mit Putin reine Zeitverschwendung! Sie haben bereits abgestimmt Christine Burbaum | 13.09.2015 | 11:00 Herr Schauer, da die Amis den IS nicht bekämpfen (wollen), lassen Sie doch Putin die Bekämpfung des IS übernehmen. Was haben Sie denn dagegen? Fürchten Sie sich davor, dass Putin mit dem Erfolg gegen den IS gekrönt würde, im Gegensatz zu den untätigen Amis, und diese blamiert werden? Sie haben bereits abgestimmt Andreas Weber |                     13.09.2015 | 01:37 Uhr Das wird den Amis aber nicht gefallen wenn hier einige dt. Politiker den USA die Gefolgschaft kündigen. Was Seehofer macht ist absolut richtig. Die Nato hätte müssen schon vor 5 Jahren einschreiten sollen, als die IS Fanatiker mit ihrem sinnlosen Morden begonnen haben. Da die Amis aber Assad um jeden Fall aus dem Weg haben wollte, war den Amis das Wirken der SI wohl gerade recht gekommen. Es sollten Seehofer noch viel mehr dt., wie Politiker anderer EU Länder folgen, damit man den Amis endlich mal zeigt, dass es nicht immer nach deren Schädel geht. Sie haben bereits abgestimmt Siegbert Bender |                     13.09.2015 | 01:37 Uhr die Botschaft hör ich wohl doch allein mir fehlt der Glauben.Aber im Anbetracht dieses Chaoses im nahen Osten wird es sicher ohne die Einbindung Russlands nicht gehen hier dem treiben einen Einhalt zu gebieten.Wir sollten endlich davon Abkommen diesem Amerikanismus nicht weiter zu folgen.Wer ist denn Schuld an der ganzen Misere?waren es doch die Amerikaner und Engländer die in der Koalition der Willigen dies alles verursachten und jetzt sind selbige nicht mal bereit bei diesem Flüchtlingschaos Flagge zu zeigen.Meine Meinung ist die Russen mit ins Boot,schlechter kanns nimmer werden. Sie haben bereits abgestimmt Tim Westerland |                     12.09.2015 | 23:53 Uhr EINER Ein einziger deutscher Politiker scheint derzeit vom Herrn mit Verstand gesegnet zu werden und das ist Horst Seehofer. Sie haben bereits abgestimmt Mathias Kuster |                     12.09.2015 | 21:55 Uhr Sollte es wirklich... wahr werden, dass endlich eine schlagkräftige Allianz geschmiedet wird? Endlich! Geht es an, gebt euch die Hände, vergesst die Unstimmigkeiten für eine Weile und fegt diese IS Horden von der Bildfläche. Jetzt heißt es die Gunst der Stunde zu nutzen. Alle Zeichen stehen auf GO ! Sie haben bereits abgestimmt ",504,True
505,Pegida,37,1885,n24.de,,,,,,http://m.n24.de/n24/Nachrichten/Politik/d/7230446/bundesregierung-macht-grenze-zu-oesterreich-dicht.html,"Im Stutthof-Prozess von Münster sagte am Dienstag der angeklagte frühere SS-Mann Johann R. aus. Er bezeichnete sich als religiösen Menschen, dem das Leben im Lager zuwider war. An ein Erlebnis konnte er sich besonders gut erinnern. Von Per Hinrichs ",505,True
